{
  "summary": "Build a single-page web app called Focus Garden to manage focus sessions and visualize progress.",
  "type": "new_feature",
  "planning_needed": true,
  "lane": "normal",
  "risk_flags": [],
  "hard_gates": [],
  "assumptions": [
    "No backend or login needed",
    "Use localStorage for data persistence",
    "Single page application structure"
  ],
  "clarifying_questions": [],
  "next_action": "plan"
}
